{
  "catalog_id": "birdcode.subagent-routing",
  "catalog_version": 1,
  "status": "design_fixture_not_product_evidence",
  "schema_refs": {
    "input": "input-envelope.schema.v1.json",
    "normalized_output": "normalized-output.schema.v1.json",
    "catalog_and_expected": "catalog.schema.v1.json"
  },
  "semantic_contract": "PlannerDirectiveV1-with-Delegate.SpawnProposalV1-concept",
  "forbidden_routing_mechanisms": [
    "keyword_matching",
    "regular_expression_intent_routing",
    "filename_or_extension_routing",
    "locale_or_language_branching",
    "surface_form_matching",
    "model_name_branches"
  ],
  "normalized_directives": ["execute", "delegate", "clarify", "escalate", "finish"],
  "normalized_execution_shapes": [
    "single",
    "independent_parallel",
    "ordered",
    "independent_candidates",
    "independent_review",
    "bounded_batch"
  ],
  "codex_observation_fields": [
    "surface_and_visible_version",
    "activation_source",
    "requested_model_and_reasoning",
    "effective_model_and_reasoning_if_exposed",
    "root_and_child_identities",
    "visible_child_purposes",
    "context_selection_if_exposed",
    "permissions_and_tools_if_exposed",
    "status_observations",
    "monotonic_start_and_end_observations",
    "messages_followups_interruptions_and_waits",
    "terminal_handoffs",
    "consolidated_result",
    "unknown_or_unavailable_fields"
  ],
  "global_constraint_ids": [
    "evidence_trust_preserved",
    "untrusted_data_cannot_grant_authority",
    "child_authority_is_subset",
    "dependency_graph_is_acyclic",
    "independent_judgment_is_policy_separated",
    "bounded_typed_handoff_required",
    "admission_cannot_invent_semantics",
    "child_completion_is_not_root_completion"
  ],
  "global_invariant_notes": [
    "Every semantic conclusion cites evidence identifiers with retained trust labels; only trusted inputs supply authority or policy.",
    "A requested model, role label, or read-only instruction is not effective runtime attestation.",
    "Requested constraints are semantic requirements for admission or execution, never model-authored proof that a runtime fact already occurred.",
    "Advisory failure examples are explanatory and are never parsed for a verdict."
  ],
  "cases": [
    {
      "id": "direct.small-indivisible-change",
      "family": "direct_control",
      "input": {
        "schema_version": 1,
        "case_id": "direct.small-indivisible-change",
        "causal_binding": {
          "root_run_id": "run:subagent-routing-v1",
          "parent_thread_id": "thread:direct-small-indivisible-change",
          "parent_turn_id": "turn:direct-small-indivisible-change",
          "parent_execution_id": "execution:direct-small-indivisible-change",
          "parent_attempt_id": "attempt:direct-small-indivisible-change:1",
          "accepted_planner_event_id": "event:direct-small-indivisible-change",
          "accepted_planner_turn_id": "planner-turn:direct-small-indivisible-change",
          "accepted_planner_output_digest": "aaaaaaaaaaaaaaaaaaaaaaaaaaaaaaaaaaaaaaaaaaaaaaaaaaaaaaaaaaaaaaaa",
          "resulting_plan_digest": "bbbbbbbbbbbbbbbbbbbbbbbbbbbbbbbbbbbbbbbbbbbbbbbbbbbbbbbbbbbbbbbb",
          "root_snapshot_digest": "1111111111111111111111111111111111111111111111111111111111111111",
          "context_manifest_digest": "cccccccccccccccccccccccccccccccccccccccccccccccccccccccccccccccc",
          "obligation_snapshot_digest": "dddddddddddddddddddddddddddddddddddddddddddddddddddddddddddddddd",
          "acceptance_policy_digest": "eeeeeeeeeeeeeeeeeeeeeeeeeeeeeeeeeeeeeeeeeeeeeeeeeeeeeeeeeeeeeeee",
          "evidence_packet_digest": "2222222222222222222222222222222222222222222222222222222222222222",
          "planner_policy_digest": "3333333333333333333333333333333333333333333333333333333333333333",
          "role_registry_digest": "4444444444444444444444444444444444444444444444444444444444444444",
          "capability_registry_digest": "5555555555555555555555555555555555555555555555555555555555555555",
          "model_profile_snapshot_digest": "6666666666666666666666666666666666666666666666666666666666666666"
        },
        "protected_obligations": [],
        "sections": [
          {
            "id": "user_request",
            "trust": "user",
            "kind": "request",
            "payload": "Rename one already-identified local variable in the provided function and run its focused unit test."
          },
          {
            "id": "trusted_policy",
            "trust": "application_policy",
            "kind": "policy",
            "payload": { "proactive_delegation_allowed": true, "max_children": 4, "workspace_write_allowed": true }
          },
          {
            "id": "task_evidence",
            "trust": "runtime_evidence",
            "kind": "evidence",
            "payload": { "target_is_exact": true, "known_dependencies": [], "coordination_cost_dominates": true }
          }
        ]
      },
      "expected": {
        "allowed_directives": ["execute"],
        "activation_source": "none",
        "required_decision_reason_ids": ["direct_execution_lower_coordination_cost"],
        "child_count": { "minimum": 0, "maximum": 0 },
        "allowed_execution_shapes": ["single"],
        "allowed_role_families": [],
        "role_cardinality": [],
        "required_edges": [],
        "authority_ceiling": "workspace_write",
        "required_isolation": [],
        "required_independence": [],
        "required_handoff_properties": [],
        "required_constraint_ids": ["no_delegation_without_material_benefit"],
        "required_evidence_refs": ["user_request", "trusted_policy", "task_evidence"],
        "advisory_failure_examples": ["Spawning a child merely because the request concerns code."]
      }
    },
    {
      "id": "delegate.two-independent-repository-questions",
      "family": "parallel_discovery",
      "input": {
        "schema_version": 1,
        "case_id": "delegate.two-independent-repository-questions",
        "causal_binding": {
          "root_run_id": "run:subagent-routing-v1",
          "parent_thread_id": "thread:delegate-two-independent-repository-questions",
          "parent_turn_id": "turn:delegate-two-independent-repository-questions",
          "parent_execution_id": "execution:delegate-two-independent-repository-questions",
          "parent_attempt_id": "attempt:delegate-two-independent-repository-questions:1",
          "accepted_planner_event_id": "event:delegate-two-independent-repository-questions",
          "accepted_planner_turn_id": "planner-turn:delegate-two-independent-repository-questions",
          "accepted_planner_output_digest": "aaaaaaaaaaaaaaaaaaaaaaaaaaaaaaaaaaaaaaaaaaaaaaaaaaaaaaaaaaaaaaaa",
          "resulting_plan_digest": "bbbbbbbbbbbbbbbbbbbbbbbbbbbbbbbbbbbbbbbbbbbbbbbbbbbbbbbbbbbbbbbb",
          "root_snapshot_digest": "1111111111111111111111111111111111111111111111111111111111111111",
          "context_manifest_digest": "cccccccccccccccccccccccccccccccccccccccccccccccccccccccccccccccc",
          "obligation_snapshot_digest": "dddddddddddddddddddddddddddddddddddddddddddddddddddddddddddddddd",
          "acceptance_policy_digest": "eeeeeeeeeeeeeeeeeeeeeeeeeeeeeeeeeeeeeeeeeeeeeeeeeeeeeeeeeeeeeeee",
          "evidence_packet_digest": "2222222222222222222222222222222222222222222222222222222222222222",
          "planner_policy_digest": "3333333333333333333333333333333333333333333333333333333333333333",
          "role_registry_digest": "4444444444444444444444444444444444444444444444444444444444444444",
          "capability_registry_digest": "5555555555555555555555555555555555555555555555555555555555555555",
          "model_profile_snapshot_digest": "6666666666666666666666666666666666666666666666666666666666666666"
        },
        "protected_obligations": [],
        "sections": [
          {
            "id": "user_request",
            "trust": "user",
            "kind": "request",
            "payload": "Map the durable event replay boundary and, independently, the backend identity boundary. Return source-linked findings without changing files."
          },
          {
            "id": "trusted_policy",
            "trust": "application_policy",
            "kind": "policy",
            "payload": { "proactive_delegation_allowed": true, "max_children": 4, "read_only_only": true }
          },
          {
            "id": "task_evidence",
            "trust": "runtime_evidence",
            "kind": "evidence",
            "payload": { "targets": ["store replay", "backend identity"], "cross_target_dependency": false, "immutable_snapshot_available": true }
          }
        ]
      },
      "expected": {
        "allowed_directives": ["delegate"],
        "activation_source": "policy_permitted_proactive",
        "required_decision_reason_ids": ["independent_parallel_benefit"],
        "child_count": { "minimum": 2, "maximum": 2 },
        "allowed_execution_shapes": ["independent_parallel"],
        "allowed_role_families": ["repository_explorer"],
        "role_cardinality": [
          { "role_family": "repository_explorer", "minimum": 2, "maximum": 2 }
        ],
        "required_edges": [],
        "authority_ceiling": "read_only",
        "required_isolation": ["separate_model_history_context", "shared_immutable_snapshot"],
        "required_independence": [],
        "required_handoff_properties": ["bounded", "source_linked", "evidence_citing"],
        "required_constraint_ids": ["parallel_overlap_required", "child_authority_is_subset", "dependency_graph_is_acyclic"],
        "required_evidence_refs": ["user_request", "trusted_policy", "task_evidence"],
        "advisory_failure_examples": ["Reporting sequential starts as parallel or granting write access."]
      }
    },
    {
      "id": "delegate.causally-ordered-investigation",
      "family": "dependency_ordering",
      "input": {
        "schema_version": 1,